05/05/1957,,"Santoshpur, India",Indian Airlines,,,Douglas C-47A,VT-AUV,20318,3,1,0,"The accident is attributed to the insufficient altitude at which the aircraft was flown during an attempt to fly through a thunderstorm. Downdrafts and divergent winds encountered
05/09/1957,19:04,"Barajas, Madrid, Spain",Aviaco,111,Santiago de Compostella - Madrid,Bristol 170 Freighter,EC-ADI,12757,37,37,0
05/13/1957,,"Near San Carlos de Bariloche, Argentina",Lineas Aereas del Estado,,,Vickers 615 Viking 1B,T-3,151,16,16,0,"The pilot lost in rain and fog searched for a landing area until the plane ran out of fuel and crashed into a 4
05/13/1957,03:35,"Narsarressuak, Greenland",U.S. Overseas Airways,,,Douglas DC-4,N68736,7449,3,2,0,Crashed into an ice cap. White-out conditions. Incorrect indication on navigation charts.
05/13/1957,,"New Delhi, India",Indian Airlines,,,Douglas DC-3,VT-CFB,13626,2,2,3,"During a training exercise the aircraft approached a stall entered a spin
06/14/1957,23:10,"Near Moscow, Russia",LOT Polish Airlines,232,Warsaw - Moscow,Ilyushin P-14,SP-LNF,6341407,13,9,0,The aircraft descended below safe altitude and struck the ground in rain and poor visibility. The crew's application of an approach procedure other than that prescribed by the airport authority.
06/18/1957,,"Bodensee, Switzerland",Swissair,,Training,Douglas C-47B,HB-IRK,20737,9,9,0,"The stalling of the aircraft following a loss of airspeed
06/22/1957,07:50,"Near Clarksburg, Maryland",Capital Airlines,,Training,Douglas C-47A,N88835,19448,3,3,0,"Loss of airspeed while executing maneuvers during a training flight
06/23/1957,14:20,"Port Hardy, BC, Canada",Queen Charlotte Airlines,,Port Hardy - Vancouver,Douglas DC-3,CF-EPI,7408,18,14,0
07/01/1957,,"Bay of Bengal, Pakistan",Pakistan International Airlines,,,Douglas DC-3,AP-AJS,12501,24,24,0,Crashed onto tidal flats off Charlakhi Island during a storm.
07/16/1957,03:36,"Near Biak, Indonesia",KLM Royal Dutch Airlines,844,Mokmer - Manila,Lockheed 1049C Super Constellation,PH-LKT,4504,68,58,0,"The pilot asked for clearance to make a low pass over Mokmer to give the passengers a final glimpse of the island. The plane gradually descended over the sea
07/25/1957,03:37,"Daggett, California",Western Airlines,39,Minneapolis -- Salt Lake - Cedar City - Las Vegas- LA,Convair CV-240,N8405H,22,16,1,0,"The plane landed safely after a dynamite bomb exploded in the rear lavatory. A passenger
08/11/1957,14:15,"Near Issoudun, Quebec, Canada",Maritime Central Airways,,Reykjavík - Montreal,Douglas DC-4,CF-MCF,18374,79,79,0
08/15/1957,,"Copenhagen, Denmark",Aeroflot,,Riga - Copenhagen,Ilyushin IL-14P,CCCP-L1874,146000607,23,23,0,Crashed into the harbor after hitting the chimney of a factory.
08/20/1957,,"Assam, India",Indamer,,,Douglas DC-3,VT-ARH,4851,8,8,0,While making a sharp turn the cargo plane stalled and crashed.
08/29/1957,,"Near Juticalpa, Honduras",Sahsa Airlines,,,Douglas DC-3,XH-SAF,17139/3440,12,12,0,Crashed during takeoff.
09/03/1957,,"Niquitao, Venezuela",Avensa,,Maiquetia - Barinas,Douglas DC-3,YV-C-AVG,4754,8,8,0,Strayed off course and collided with a mountain in the Penas Blancas hills.  Pilot error.  Weather's influence on radio communications. Leaving the prescribed route and flying at too low an altitude.
09/15/1957,20:46,"New Bedford, Massachusett",Northeast Airlines,285,Martha's Vineyard - New Bedford,Douglas DC-3,N33417,7337,24,12,0,The aircraft struck trees to the right and short of the runway during approach in fog. The pilot attempted to make a visual approach by descending prematurely in the approach area without adherence to the prescribed ILS approach procedure which was dictated by existing weather conditions.
09/18/1957,21:20,"Montevideo,  Uruguay",REAL,,San Pablo - Porto Alegre - Montevideo,Convair CV-440-62,PP-AQE,456,35,1,0,"Flying VFR
09/28/1957,,,British European Airways,,,de Havilland DH-114 Heron,G-AOFY,14099,3,3,0,"The pilot did not appreciate that the air ambulance had rapidly lost height whilst he was making a visual half circuit to land. This could not have been due to the absence of sufficient visual reference in the prevailing conditions of darkness, very low cloud and drizzle. The urgent nature of the flight is considered to have influenced the pilot's decision to land."
10/03/1957,,"Beirut, Lebanon",Lebanese International Airways,,Beirut - Kuwait City,Curtiss C-46A-45-CU,OD-ACK,30249,27,27,0,Crashed into the ocean on takeoff.
10/23/1957,16:51,"Belfast, Ireland",British European Airways,,London - Belfast,Vickers 802 Viscount,G-AOJA,150,7,7,0,"While attempting to land at Belfast
10/28/1957,18:05,"Madrid, Spain",Iberia Airlines,,Tanger - Madrid,Douglas DC-3,EC-ACH,19332,21,21,0,"Intense fire in the No.1 engine while en route
10/30/1957,,"Near Campeche, Mexico",Transportes Aereos Mexicanos,,,Fairchild C-82A,XA-LIW,,3,3,0,The cargo plane crashed en route.
11/06/1957,,"Bristol, England",Bristol Aeroplane Co.,,,Bristol Britannia 175,G-ANCA,12917,15,15,0,Crashed on a training flight. The right wing suddenly dropped and the aircraft went into a very steeply banked right hand turn and crashed. Instrument failure leading to loss of control. Undetermined cause. Possible failure of the auto-pilot.
11/09/1957,16:27,"900 miles E of Honolulu, Hawaii, PacifiOcean",Pan American World Airways,7,San Fransisco - Honolulu,Boeing - 377-10-29 Stratocruiser,N90944,15960/40,44,44,0
11/15/1957,20:08,"Near Palma de Mallorca, Spain",Aviaco,,Barcelona - Palma de Mallorca,de Havilland DH-114 Heron 2D,EC-ANZ,14117,4,4,0,"The aircraft hit a mountain at 1
11/15/1957,22:54,"Chessell Down Hants, England",Aquilla Airways,,Southhampton - Lisbona,Short Solent 3 (flying boat),G-AKNU,S-1299,58,43,0,The plane crashed into the face of a quarry between Chessel and Brook on the Isle of Wight. The last message transmitted from the aircraft was 'No. 4 engine feathered. Coming back in a hurry.'  Electrical failure or accidental cut-off of the fuel actuator circuit of the No. 3 and No. 4 engines.
11/21/1957,11:33,"Christchurch, New Zealand",Straits Air Freight Express,,Paraparaumu - Timaru,Bristol 170 Freighter 31,ZK-AYH,12828,4,4,0,The cargo plane lost a wing in flight and crashed into farmlands. In-flight structural fatigue failure of the starboard front lower spar boom.
12/08/1957,16:45,"Bolivar, Argentina",Aerolineas Argentinas,,Buenos Aires - San Carlos,Douglas DC-4,LV-AHZ,27227,61,61,0,The plane crashed during a storm. Left wing detached in extreme turbulence. The pilot descending on a track well below the minimum safety flight altitude established for this type of operation. The absence in the flight plan of a forecast showing the intensity of the meteorological phenomena encountered. Inadequate operational dispatch of the aircraft.
12/10/1957,,"Jeannine Lake, Quebec, Canada",Northern Wings,,,Douglas C-47A,CF-GKV,13837/25282,3,3,0
12/11/1957,13:12,"Ozamis City, Philippines",Philippine Air Lines,,Ozamis City - Pagadian,de Havilland Canada DHC-3 Otter,,,12,2,0,While taking off the plane stalled and hit trees. The uncontrollable stall at low altitude which resulted from the abrupt steep climb immediately after takeoff. Contributing factors were the improper loading of the aircraft and the prevailing gusty wind with a relatively high ambient temperature.
12/23/1957,,"Stansted, England",Scottish Airlines,,Malta - London,Avro 685 York C-1,G-AMUN,,4,4,0,The cargo plane crash landed short of the runway on the third landing attempt. The accident was due to an error on the part of the captain in that while making an attempt to land he continued the approach below the critical height without sufficient visual reference to the ground.
12/23/1957,16:00,"Off Oahu, Hawaii",Military - U.S. Navy,,,Lockheed WV-2,143197,,23,19,0,"The aircraft lost all power during a simulated emergency maneuver and struck the water after descending from a altitude of 1
12/31/1957,,"Buenos Aires, Argentina",Aerolineas Argentinas,,Buenos Aires - Rosario - Corrientes,Short Sunderland,LV-AAR,,51,9,0,The flying boat sank in Buenos Aires harbor while trying to make an emergency landing after losing an engine.
01/16/1958,,"Belem, Brazil",Cruzeiro,,,Fairchild C-82A,PP-CEF,10200,3,3,0,The cargo plane lost the No. 1 engine on takeoff and crashed.
01/20/1958,,"Near La Paz, Bolivia",TAM (Bolivia),,Tipuani - La Paz,Douglas DC-3,TAM-04,,11,11,0,Crashed in mountainous terrain while en route.
02/01/1958,,"Rio de Janeiro, Brazil",Loide Aéreo Nacional,,Rio de Janerio - Fortaleza,Douglas DC-4,PP-LEM,18336,67,5,0,The plane abandoned the takeoff after an engine failed. The plane was unable to stop and slid off the runway striking rocks and catching fire. Failure of No. 4 engine. Malfunctioning of the starboard brakes.
05/15/1958,,"New Delhi, India",Pakistan International Airlines,205,Dehli - Karachi,Convair CV-240-7,AP-AEH,52,38,21,2,Crashed shortly after taking off. Improper observation and interpretation of instruments. The captain did not properly observe and interpret his flight instruments and thus inadvertently permitted the aircraft to descend to the ground immediately after a night takeoff during which no visual reference was possible.
02/01/1958,19:15,"Norwalk, California",Military - U.S.  Air Force / Military - U.S. Navy,,Long Beach - McGuire AFB,Douglas C-118A / Lockheed P2V-5F,53-3277A/127723,44622/,49,47,1,"The two aircraft collided at an altitude of 3
02/06/1958,14:17,"Munich, Germany",British European Airways,609,Munich - Manchester,Airspeed Ambassador A5-57,G-ALZU,5217,44,23,0,"The aircraft crashed during takeoff in a snowstorm. The aircraft never lifted from the runway
02/19/1958,,"Motu Taoru, France",Réseau Aérien Interinsulaire,,,Consolidated PBY-5A  Catalina,F-AOVV,,15,15,0,Struck the water and sank after the right wing tip float contacted the water during a shallow turn for final approach.
02/20/1958,05:35,"Off Corvo Island, Azores",Military - U.S. Navy,,,Lockheed WV-2,BU-141310,,22,22,0,Disappeared while on patrol about 100 miles from the Azores. No trace of the aircraft was ever found.
02/27/1958,09:45,"Horwich, Lancs, England",Silver City Airways,,Isle of Man - Manchester,Bristol 170 Freighter 21,G-AICS,12762,42,35,0
03/07/1958,19:45,"Off Ryukyu Islands, Okinawa",Military - U.S. Marine Corps/Military - U.S. Marine Corps,,,Fairchild R4Q / Dougas AD-6 skyraider,129741/135350,,26,26,0,The aircraft collided after descending from a holding pattern while  attempting to land at Naha Air Base.  Failure of the AD-6 pilot to maintain his position. One killed aboard the AD-6. Poor judgement on the part of the R4Q Plane Commander.
03/07/1958,,"Menzalah Lake, Egypt",Misrair,,Athens - Cairo,Vickers 628 Viking 1B,SU-AGN,196,26,8,0,"While approaching Cairo
03/22/1958,02:05,"Grants, New Mexico",Private,,,Lockheed 18 Lodestar,N300E,2312,4,4,0,"The aircraft went down 35 miles SW of Grants
03/24/1958,,"Near Kathmandu, Nepal",Indian Airlines,,Simra - Kathmandu,Douglas DC-3,VT-CYN,19988,20,20,0,"Due to a navigational error the aircraft flew the wrong route into a valley. While maneuvering to make a turn
03/25/1958,,"Miami, Florida",Braniff Airlines,971,,Douglas DC-7-C,N5904,45072/793,24,9,0,The plane crashed 2 minutes after takeoff while trying to return to the airport  after reporting a fire in the No. 3 engine. The failure of the captain to maintain altitude during an emergency return to the airport due to his undue preoccupation with an engine fire following takeoff.
03/27/1958,16:15,"Bridgeport, Texas",Military - U.S. Air Force/Military - U.S. Air Force,,,Douglas C-124C / Fairchild C-119C,52-981A/49-195A,,18,18,0,"Collided in midair while cruising at 6
04/02/1958,,"Quito, Ecuador",Transportes Aereos Orientales,,Quito - Esmeraldas,Junkers JU-52/3m,HC-SND,J5109,14,3,0,
04/06/1958,23:19,"Freeland, Michigan",Capital Airlines,67,New York - Detroit - Saginaw - Chicago,Vickers Viscount 745D,N7437,135,47,47,0,"The aircraft stalled and crashed into a corn field
04/07/1958,09:00,"Mt. Illiniza, Ecuador",AREA,222,Guayaquil - Quito,Douglas DC-3,HC-ACL,19779,32,32,0,Flew into a mountain 15 minutes after leaving Guayaquil. Procedural error. The pilot did not maintain IFR until clear of the cloud cover.
04/14/1958,20:07,"Off Castell de Fels, Spain",Aviaco,,Zaragoza - Barcelona,de Havilland DH-114 Heron 2D,EC-ANJ,14113,16,16,0,Crashed into the ocean after a sudden avoidance manuver. ATC error. Another aircraft was permitted to takeoff without the exact position of the plane being known.
04/21/1958,08:30,"Near Sloan, 10 miles SW of Las Vegas, Nevada",United Air Lines / Military - U.S. Air Force,736,Los Angeles - New York City,Douglas DC-7 / F-100F,N6328C/56-3755,45142 /243-31,49,49,0
05/18/1958,04:30,"Near Casablanca, Morocco",Sabena,,Lisbon - Leopoldville,Douglas DC-7C,OO-SFA,45157/737,65,61,0,"The aircraft developed trouble in the No. 1 engine while en route from Lisbon to Leopoldville. While attempting to land in poor visibility on 3 engines
05/20/1958,11:29,"Brunswick, Maryland",Capital Airlines / Military - Air National Guard,300,Pittsburgh - Baltimore,Vickers Viscount 745D / T-33A,N7410/53-5966,108,11,11,0,"Midair collision at 8
05/25/1958,,"Gurgaon, India",Dan-Air Services,,,Avro 685 York C-1,G-AMUV,,5,4,0,A fire in fligth caused by a failure of the No. 1 engine. During the ensuing forced landing on rough terrain the aircraft broke up and was consumed by fire.
05/31/1958,,"SW of Algiers, Algeria",Air France,,Algier - Colomb-Bechar - Tindouf,Douglas DC-3,F-BHKV,20001,15,15,0,Crashed into mountains 100 miles southwest of Algiers.
05/31/1958,,"Rio de Janeiro, Brazil",Paraense Transportes Aéreos,,,Curtiss C-46D,PP-BTB,33304,4,4,0,The cargo plane crashed.
06/02/1958,05:23,"Manila, Philippines",Pan American World Airways,,San Francisco - Singapore,Boeing 377 Stratocruiser 10-26,N1023V,15923,57,1,0,"A hard landing in heavy rain and gusty winds at Manila caused the collapse of the right main landing gear. A prop broke off the No. 3 engine
06/02/1958,,"Near Guadalajara, Mexico",Aeronaves de Mexico,,Guadalajara - Mexico City,Lockheed 749A Constellation,XA-MEV,2665,45,45,0,The plane crashed into La Latilla mountain 13 km west of Guadalajara. The aircraft did not climb out in accordance with approved procedures.
06/04/1958,13:58,"Martinsburg, West Virginia",Capital Airlines,,Training,Douglas DC-3,N49553,4820,3,1,0,"Following the trainee-pilot's failure to maintain minimum-control speed during an attempted go-around
06/16/1958,,"Curitiba, Brazil",Cruzeiro,,Florianopolis - Curitiba,Convair CV-440-59,PP-CEP,493,27,19,0,Crashed during approach after encountering a downdraft. Missed the runway and collided with a tree. Windshear.
06/25/1958,,"Mohanbari, India",Indian Airlines,,,Douglas C-47A,VT-COJ,10051,7,7,0,While manoeuvring at a low height in mountainous terrain during a supply dropping mission the port wing of the cargo plane grazed the side of a hill thus causing the aircraft to slew and crash. A contributory factor might have been the mismanagement of the fuel system which caused temporary loss of engine power and height.
06/27/1958,00:30,"Near Chicopee Falls, Massachusetts",Military - U.S. Air Force,,Westover AFB - London,Boeing KC-135A,56-3599A,17348,15,15,0,"The aircraft crashed while attempting to break a transatlantiflight record. Heavily loaded with fuel
07/09/1958,,"Dhaka, Baangladesh",Indian Airlines,,,Douglas C-47A,VT-CYM,19317,3,3,0,Structural failure in the air.
08/09/1958,01:14,"Benghazi, Libya",Central African Airways,,Wadi Halfa - Benina,Vickers Viscount 748D,VP-YNE,102,54,36,0,Crashed into high ground during approach. Misinterpreted or misread altimeter reading. Possible fatigue.
08/12/1958,,"Sakiya Saugye, Japan",All Nippon Airways,,Tokyo - Nagoya,Douglas DC-3,JA5045,7336,33,33,0,Ditched into the sea near Izu Island appoximately 1 hour after taking off after experiencing engine trouble.
08/12/1958,,"Maraso Bay, Brazil",LANSA,,,Douglas DC-4,PP-LEQ,10544,10,10,0,Crashed on approach. Cause unknown.
08/14/1958,03:45,"North AtlantiOcean, 100 miles W of Galway Bay, Ireland",KLM Royal Dutch Airlines,607E,Amsterdam - Shannon - Gander - New York,Lockheed 1049H Super Constellation,PH-LKM,4841,99,99,0
08/15/1958,,"Nantucket, Massachusett",Northeast Airlines,258,New York City - Nantucket,Convair CV-240-2,N90670,90,34,24,0,"The aircraft crashed 1
08/15/1958,,"Near Chita, Russia",Aeroflot,,,Tupolev TU-104-A,CCCP-L5442,,64,64,0,The aircraft stalled after flying over a thunderstorm. The aircraft climbed in excess of its operational ceiling considering its weight.
09/02/1958,,"Sasnashen, Russia",Military - U.S. Air Force,,,Lockheed C-130A-II Hercules,56-0528,3136,17,17,0,Shot down by Soviet Mig fighters.
09/02/1958,,"London, England",Independent Air Travel,,,Vickers 621 Viking 1,G-AIJE,127,3,3,4,The cargo plane lost an engine on the initial climb and was not able to maintain altitude and crashed.
09/02/1958,06:10,Off Guam,Military - U.S. Air Force,,Guam - Clark AB,Douglas C-124C Globemaster,52-1081A,,19,19,0,The aircraft crashed 35 miles west of Agana Naval Air Station. In-flight fire of unknown origin.,
09/05/1958,,"Campina Grande, Brazil",Loide Aereo Nacional,,,Curtiss C-46A-CU,PP-LDX,30288,18,13,0,The aircraft crashed after a second landing attempt. Improper approach procedure. Incorrect forcast provided to the crew.
09/08/1958,,"Near Fairchild AFB, Washington DC",Military - U.S. Air Force / U.S. Air Force,,,Boeing B-52 / Boeing B-52,56-661 / 56-681,,16,13,0,"In VFR conditions the two Boeing B-52 Stratofortress bombers approached the same runway at the same time. The two aircraft rammed into each other 900 feet above the ground and crashed. Eight out of 9 aboard 56-661 were killed. Five out of 7 aboard 56-681 were killed. Operator error
09/09/1958,,"Mount Oyama, Japan",Flying Tiger Line,,,Lockheed L-1049H Super Constellation,N6920C,4822,8,8,0,Crashed into Mount Oyama 15 miles southwest of Tokyo.
09/15/1958,,"Triel, France",Military - U.S. Air Force,,,Lockheed C-130A Hercules,56-0526,3134,15,15,0,Midair collision.
09/29/1958,,Over the Mediterranean Sea,Middle East Airlines,,Beirut - Rome,Avro 685 York I,OD-ADB,1307,5,5,0,The cargo plane disappeared over the Mediterranean Sea and was never found.,
10/09/1958,,"Payette, Idaho",Military - U.S. Air Force,,,Fairchild C-123 Provider,55-4521A,,19,19,0,Crashed and exploded on flat terrain easts of Payette. A loss of control or the incapacitation of one of the pilots may have factored in the accident.
10/14/1958,00:22,"Mt. Alto del Cedro, Venezuela",Linea Aeropostal Venezolana,,,Lockheed 1049E Super Constellation,YV-C-ANC,4575,23,23,0,Crashed into the Alto del Cedro mountain. Premature descent. Navigation error. Lack of navigation facilities in the area.
10/15/1958,,"Villa Montes, Bolivia",TAM (Bolivia),,Fortin Campero - Tarija,Douglas C-47A,TAM-03,13839,20,20,0,Crashed into mountain while en route.
10/17/1958,,"Near Kanash, Russia",Aeroflot,,Peking - Moscow,Tupolev TU-104A,CCCP-42362,,80,80,0,"The plane was on a flight from Peking to Moscow at FL330 when it went out of control. The aircraft experienced extreme turbulence during a climb
10/18/1958,,"Placentia Bay, Canada",Military - U.S. Navy,,"Patuxent River, NAS - Argentia,NAS",Lockheed WV-2 Super Constellation,Bu141294,,29,11
10/22/1958,11:50,"Anzio, Italy",British European Airways,142,London - Napoli,Vickers Viscount 701C,G-ANHC,63,31,31,0,Midair collision with an Italian Air Force F-86. The airliner drifted off course. Neither pilot saw each other before they collided.
11/01/1958,02:01,"Nipe Bay, Cuba",Cubana de Aviacion,495,Miami - Varadero,Vickers Viscount 755D,CU-T603,91,20,17,0,"Hijacked by 4 Cuban rebels
11/03/1958,20:00,"Near Roccatamburo di Poggiodomo, Italy",Yemen Airlines,,Rome - Belgrade,Douglas C-47-DL,YE-AAB,4345,8,8,0,"The DC-3 was to fly the Yemenite Under Secretary of Foreign Affairs from Rome to Belgrade. The aircraft The aircraft crashed on the western slopes of Mount Porretta at an elevation of 2
11/08/1958,,"La Paz, Bolivia",TAM (Bolivia),,San Borja - La Paz,Douglas DC-3,TAM-05,,3,3,0,The cargo plane disappeared en route.
11/09/1958,13:21,North AtlantiOcean,ARTOP Aerotopografica LDA,,Cabo Ruivo - Funchal,Martin Mariner,CS-THB,59144,36,36,0,The aircraft was missing on a flight from Cabo Ruivo to Funchal over the North Atlantiafter transmitting an emergency message positioning the aircraft at  36 degrees 40 minutes N 12 degrees W.,
11/16/1958,,"Fort Collins, Colorado",Capitol Airways,,,Curtiss C-46F,N1301N,22480,2,2,0,"The cargo plane lost an engine while enroute and crashed. Icing
12/04/1958,17:15,"Guadarrama Mountains, Spain",Aviaco,,Vigo - Madrid,SNCASE Languedoc,EC-ANR,28,21,21,0,Crashed into La Rodilla de la Mujer Muerta while on approach to Madrid. Loss of control due to icing and turbulence.
12/24/1958,11:58,"Winkton, England",BOAC,,Test,Bristol 175 Britannia 312,,,12,9,0,While descending the aircraft struck the ground in heavy fog.
12/26/1958,12:52,"Salisbury, Zimbabwe",Union Aeromaritime de Transport,736,Johannesberg - Salisbury - Brazzaville - Nice - Paris,Douglas DC-6B,F-BGTZ,43827/337,70,3,0,"The aircraft took off into heavy thunderstorms
12/30/1958,,"Rio de Janeiro, Brazil",VASP,,Rio de Janeiro - Sao Paulo,Saab Scandia,PP-SQE,103,37,21,0,Crashed on takeoff after the No.1 engine failed. Pilot error. Pilot's incorrect handling of controls in flight.
01/13/1962,,"Near Tippi, Ethiopia",Ethiopian Airlines,,Tippi - Jimma,Douglas DC-3,ET-T-1,10053,18,5,1,Swerved off the runway while taking off and struck a structure.
01/06/1959,11:20,"Mt. Pena Blanca, Guatemala",Sahsa Airlines,,Copan - Nuovo Octopeque,Douglas DC-3,XH-SAA,19667,5,5,0,Crashed into Mt. Pena Blanca while en route. The pilot's attempt to fly over mountainous terrain by visual reference to the ground under weather conditions restricting visibility which forced him to descend to a dangerously low altitude.
01/08/1959,20:32,"Mt. Holston, Tennessee",Southeast Airlines,308,Nashville - Knoxville - Tri-City Aport,Douglas DC-3,N18941,2007,10,10,0,"The aircraft struck a mountain during an ILS approach to Tri-City Airport. Pilot's failure to identify an intersection properly
01/11/1959,,"Rio de Janeiro, Brazil",Lufthansa,,Hamburg - Rio de Janeiro,Lockheed 1049G Super Constellation,D-ALAK,4602,39,36,0,"The plane descended over Guanabara Bay in rain
01/14/1959,,"Panther Peak, California",California Air Freight,,"Burbank, CA - Seattle, WA",Curtiss C-46F,N1240N,22404,2,2
01/16/1959,21:40,"Off Mar del Plata, Argentina",Austral Lineas Aeras (Argentina),,Buenos Aires - Mar del Plata,Curtiss C-46A-50-CU,LV-GED,30514,52,51,0,"The aircraft overshot runway and a missed approach procedure was initiated. The plane gradually descended into the ocean just offshore. The pilot was not familiar with the airport and he miscalculated during the instrument approach procedure. The pilot's temporarily confused mental state when he found himself in this critical situation
01/21/1959,,"Near Merida, Venezuela",Linea Expresa Bolivar,,Merida - Lagunillas,Curtiss C-46D-15-CU,YV-C-LBI,33411,4,4,0,"While en route
01/22/1959,15:00,"Dabouk, Jordan",Air Jordan,601,Jerusalem - Dobouk,Convair CV-240-2,JY-ACB,55,15,10,0,Struck trees during approach and crashed 2.8 miles northwest of Wadi-Es-Sir. Adverse weather conditions.
01/27/1959,06:10,"Brindisi, Italy",Air Charter,,,Avro 688,G-AGRG,1255,6,2,0,"Overran the runway while taking off
02/01/1959,23:37,"Kerrville, Texas",General Airways,,"Pueblo, CO - San Antoonio, TX",Douglas DC-3,N17314,1924,28,3
02/03/1959,01:00,"Mason City, Iowa",Dwyer Flying Service - Private Charter,-,Mason City - Fargo,Beechcraft Bonanza 35,N3794N,D- 1019,4,4,0,"Buddy Holly chartered the plane to fly to Fargo after appearing as part of the Winter Dance Party tour at Clearlake
02/03/1959,23:56,"La Guardia Airport, New York, NY",American Airlines,320,Chicago - New York City,Lockheed  188A Electra,N6101A,1015,73,65,0
02/17/1959,16:00,"Gatwick, Surrey, England",Turkish Airlines (THY),,Ankara - Istanbul -  London,Vickers Viscount 794D,TC-SEV,429,24,14,0
02/18/1959,,"Belen, Chile",Southern Cross Airways,,"Arica, Colombia - Puerto Suarez, Bolilvia",Curtiss C-46A,N68823,26818,5,5
11/21/1959,,"Beirut, Lebanon",Ariana Afghan Airlines,202,Beirut - Tehran,Douglas DC-4,YA-BAG,18367,27,24,0,"Crashed shortly after takeoff
03/05/1959,11:35,"Managua, Nicaragua",TACA,,Las Mercedes - Tegucigalpa,Vickers Viscount 763,YS-09C,82,19,15,0,"Crashed shortly after takeoff
03/12/1959,14:10,"Tobu, India",Indian Airlines,,,Douglas C-47A,VT-CYH,12493,7,5,0,The cargo plane crashed during an attempt by the pilot to clear high terrain under poor visibility conditions. He had previously descended to a low altitude in order to determine his position.
03/13/1959,08:00,"Mahon, Spain",Aviaco,,Palma de Mallorca - Mahon,Bristol 170 Freighter 21E,EC-ADH,12776,18,1,0,"The plane banked to the right soon after leaving the ground and crashed to the ground. Strong gust of wind which tilted the aircraft to the right during final approach to land
03/29/1959,,"Near Banga, Central African Republic",Union Aeromaritime de Transport,,,Nord 2501 Noratlas,F-BGZB,2,9,9,0,Crashed while en route in the jungle.
03/29/1959,10:45,"Near Silchar, India",Indian Airlines,,Dum Dum - Agartala-Singerbhil - Kumbhirgram,Douglas DC-3,VT-CGI,20176,24,24,0,Sustained structural failure while flying through a thunderstorm.
03/30/1959,,"Alma, Georgia",Riddle Airlines,402,"Orlando, FL - Atlanta, GA",Curtiss C-46A,N7840B,30242,2,2
04/17/1959,,"Puerto Kino, Mexico",Tigres Voladores,,Mexicale - Guaymas,Curtiss C-46F-1-CU,XA-MIS,22586,26,26,0,Exlpoded and caught fire near Bahia de Kino.  A bomb is believed to have exploded onboard.
04/23/1959,,"Van, Turkey",Air Charter,,"Ankara, Turkey - Bahrain",Avro 688 Super Trader,G-AGRH,1256,12,12,0
