08/28/1973,21:45,"Near Huete, Spain",Military - U.S. Air Force,,Athens - Madrid,Lockheed C-141A,63-8077,6008,25,24,0,"The aircraft was cleared to 5
08/28/1973,20:50,"Thirty-five miles west of Los Angeles, California",Trans World Airlines,742,Honolulu - Los Angeles,Boeing B-707-331B,N8705T,18916/455,149,1,0,"The plane porpoised while descending to LAX. The aircraft was subjected to 2 minutes of peak acceleration forces of 2.4 g.  A combination of design tolerances in the aircraft's longitudinal control system which
09/04/1973,22:30,"Gary, Indiana",Aegler Stuart Flying Service  / Private,,"Grand Rapids, MI - Gary, IN",Piper PA-30 / Cessna 337A,N7881Y / N6270F,,5,4
09/08/1973,04:42,"King Cove, Alaska",World Airways,,"Travis AFB - Clark AFB - Yokota AFB, Japan",McDonnell Douglas DC-8-63F,N802WA,46146,6,6,0
09/09/1973,15:18,"Paintsville, Kentucky",Wicks Flying Service - Air Taxi,,"Humbolt, TN - Paintsville, KY",Cessna 310H,N1834H,,4,4
09/11/1973,,"Moganik, Yugoslavia",JAT Yugoslav Airlines,,Skopje - Titograd,Aerospatiale Caravelle 6N,YU-AHD,151/149,41,41,0,"The aircraft struck Moganik Mountain at 6
09/20/1973,22:45,"Natchitoches, Louisiana",Private Charter,-,"Natchitoches, La - Dallas, TX",Beechcraft E18S,N50JR,BA-176,6,6
09/24/1973,02:00,"Eagleville, California",Dunlap Aviation - Air Taxi,,"Bakersfield, CA - Long Beach, CA",Cessna 310,N3015C,,2,2
09/25/1973,06:18,"Lincoln, Nebraska",Lisa Jet Inc. - Air Taxi,,"Lincoln, NB - Omaha, NB",Gates Lear 25,N40LB,,3,3
09/27/1973,19:52,"Rich Mountain, Arkansas",Texas International Airlines,655,Memphis - El Dorado - Texarkana - Dallas,Convair 600,N94230,56,11,11,0,"The aircraft flew100 miles off course and struck Black Fork Mountain
09/30/1973,,"Miritituba, Brazil",Aeronorte,,,Douglas DC-3A,PT-CEV,20182,9,9,0,"The crew started the takeoff roll at a point 200m down the runway
09/30/1973,20:40,"Near Sverdlovsk, Russia",Aeroflot,,,Tupolev TU-104B,CCCP-42506,21904,108,108,0,"The aircraft crashed shortly after takeoff while on a go-around. After reaching an altitude of 1
10/02/1973,,"Magadan, Russia",Aeroflot,,,Antonov AN-12V,CCCP-12967,9346502,10,10,0,Struck high ground after going off course during a go-around.
10/04/1973,,"Itaituba, PA, Brazil",Taxi Aéreo Cesar Aguiar,,,Britten-Norman BN-2A-7 Islander,PT-DVN,259,8,8,0
10/23/1973,,"Guanabara Bay, Brazil",VASP,,Rio de Janeiro - Belo Horizonte,NAMC YS-11A-211,PP-SMJ,2068,65,8,0,"The takeoff from Santos Dumont airport was aborted after a loss of power occurred before the V1 speed was reached. Due to poor braking action
10/29/1973,,Sainte Lucia Island,CATA,,,Britten-Norman BN-2A-6 Islander,N37JA,210,4,4,0,Flew into Mt. Gimie while en route.,
10/31/1973,06:05,"La Verne, California",Jack N. Boswick - Air Taxi,,"La Verne, California - Willow Rock, Arizona",Cessna 401A,N6273Q,,7,2
11/02/1973,,"Villavicencio, Colombia",Lineas Aéreas La Urraca,,Arauca - Cucuta,Handley Page HPR-7 Herald 101,HK- 718,150,16,6,0,The aircraft crashed after diverting to Villavicencio after experiencing hydrauliproblems and having to feather the No. 1engine.
11/03/1973,16:40,"Near Albuquerque,  New Mexico",National Airlines,27,"Miami, FL - San Francisco, CA",McDonnell Douglas DC-10-10,N60NA,46700/14,128,1
11/03/1973,09:39,"Boston, Massachusett",Pan American World Airways,160,New York City - Prestwick,Boeing B-707-321C,N458PA,19368/640,3,3,0,Smoke in the cockpit and uncontrollable fire caused by spillage of nitriacid on sawdust packing in the cargo hold. The aircraft was named 'Clipper Titian.'
11/17/1973,,"Near Quang-Ngai, Vietnam",Air Vietnam (South Vietnam),,,Douglas DC-3,XV-NIE,14910/26355,27,27,0,Flew into a mountain while en route. Flying under VFR in IFR conditons.
12/07/1973,,"Moscow, Russia",Aeroflot,,,Tupolev TU-104B,CCCP-42503,21901,72,13,0,The aircraft crashed after the wing touched the ground while landing short of the runway.
12/09/1973,22:55,"Churchill Falls, Newfoundland, Canada",Churchill Falls Co.,,Montreal - Churchill Falls,de Havilland DH-125-400A,CF- CFL,NA741/25213,8,8,0
12/11/1973,,"Sitkin Island, Alaska",Military - U.S. Navy,,Elmendorf AFB - Adak,Douglas DC-118,131615,43718/371,10,10,0,Struck a mountain 40 miles from Adak.
12/16/1973,,"Near Vilnius, Lithuania",Aeroflot,,,Tupolev TU-124,CCCP-45061,3351406,51,51,0,Went into a sudden dive and crashed to the ground.
12/17/1973,13:00,"Rome, Italy",Pan American World Airways,110,Rome - Beirut,Boeing B-707-321B,N407PA,18838,177,30,0,Two phosphorus bombs were thrown into the aircraft prior to its departure. The aircraft was named 'Clipper Celestial.'
12/18/1973,19:14,"Manhattan, Kansas",Capitol Air Service - Air Taxi,,"Norman, OK - Manhattan, KS",Cessna 310L,N3269X,,2,2
12/21/1973,,"Talara, Peru",TAM (Bolivia),,US - La Paz,Convair CV-440,TAM-47,444,9,6,0,Crashed on approach.
12/21/1973,,"Near Siagon, South Vietnam",Military - Vietnamese Air Force,,,Boeing Vertol CH-47 (helilcopter),,,20,20,0,Ammunition exploded while the aircraft was on the ground.
12/22/1973,22:10,"Near Tetouan, Morocco",Sobelair SA (Belgium),,Paris - Tanger,Sud-Aviation Caravelle VI-N,OO-SRD,069/84,106,106,0,"After missing the outer marker
12/23/1973,,"Lvov, Ukraine, USSR",Aeroflot,,,Tupolev TU-124,CCCP-45004,350202,17,17,0
12/28/1973,,"Durban, South Africa",Executive Funds,,,Douglas DC-3,ZS-DAK,1498,25,1,0,"The No.1 engine failed while the DC-3  turned onto final approach.  Shortly thereafter
01/01/1974,12:38,"Near Turin, Italy",Itavia,,Bologna - Torino,Fokker F-28 Fellowship 1000,I-TIDE,11015,42,38,0,Crashed 2 miles short of the runway during an approach in fog and heavy rain.
01/06/1974,,"Unduavi, Bolivia",Servicios Aéreos Boliviano,,San Borja - La Paz,Curtiss C-46F,CP-990,22490,4,4,0,The cargo plane hit a mountain en route.
01/06/1974,18:05,"Johnstown, Pennsylvania",Air East,,"Pittsburgh, PA - Johnstown, PA",Beechcraft 99A,N125AE,U-125,17,12
01/06/1974,,"Mukachevo, Russia",Aeroflot,,,Antonov AN-24V,CCCP-46357,77303405,24,24,0,
01/09/1974,16:36,"Near Nevia, Colombia",Military - Colombian Air Force,,Florencia - Bogota,Hawker Siddeley HS 748-260,FAC-1103,1704,31,31,0,The domestiflight crashed into a mountain while en route to Bogota. A fire broke out in the cabin soon after taking off.
01/10/1974,,"La Paz, Bolivia",TAM (Bolivia),,Santa Rose - La Paz,Douglas C-54,TAM-52,,24,24,0,The non-scheduled passenger flight crashed while en route to La Paz.
01/17/1974,18:15,"Cigerdu, Colombia",Cessnyca,,,Douglas DC-3A,HK-1216,1905,14,14,0,Crashed after climbing to cruising altitude.
01/25/1974,,"Rostov, Russia",Aeroflot,,,Antonov An-24B,CCCP-46277,77303610,4,4,0,On a positioning flight the aircraft crashed past the end of the runway. Failure of the artificial horizon.
01/25/1974,06:58,"Goldendale, Washington",Inland Aviation - Air Taxi,,"Ephrata, WA - Portland, OR",Cessna 172L,N7888G,,2,2
01/26/1974,07:30,"Izmir, Turkey",Turkish Airlines (THY),,Izmir - Istanbul,Fokker F-28 Fellowship 1000,TC-JAO,11057,73,66,0,"The plane yawed left
01/27/1974,13:15,"S. Dominican Pueblo, New Mexico",Taos Airways - Air Taxi,,"Taos, NM - Albuquerque, NM",Beechcraft J-35,N633Q,,3,3
01/28/1974,07:50,"Winger, Minnesota",Theif River Aviation - Air Taxi,,"Thief River, MN - Owatonna, MN",Piper PA-28,N5290S,,4,4
01/30/1974,23:41,"Pago Pago, American Samoa",Pan American World Airways,806,Auckland - Pago Pago,Boeing B-707-321B,N454PA,19376/661,101,96,0,"The aircraft crashed and burned while making ILS approach to Pango Pango International Airport. There was a failure of the crew to correct an excessive rate of descent causing the aircraft to fly into trees short of the runway. Windshear
02/02/1974,21:30,"Near Honolulu, HI",Pan American World Airways,,"San Francisco, CA - Honolulu, HI - Agana, Guam",Boeing B-747,N732PA,19638/3,298
02/09/1974,17:30,"Near Souda, Crete",Military - West German Air Force,,,Transall C-160D,50-63,,40,35,0,"The twin-engine turboprop hit a mountain at an elevation of 5
02/10/1974,19:31,AtlantiOcean,North Cay Air - Air Taxi,,"St. Croix, VI - St. Thomas, VI",Brittonnorman BN-2A6,N864JA,,2,2,0
02/22/1974,,"Baltimore, Maryland",Delta Air Lines,523,Baltimore - Atlanta,MDonnell Dougals DC-9,,,15,1,0,"An out of work Pennsylvania salesman
02/23/1974,,"San Francisco de Moxos,  Bolivia",SAVCO,,,Curtiss C-46A-45-CU,CP-1052,30195,7,7,0,Severe turbulence possibly caused the failure of ropes securing cargo. The center of gravity shifted causing a loss of control. The wreckage was found 2 days later.
02/28/1974,,"Near Mehrabad, Iran",Military - Imperial Iranian Air Force,,,Lockheed C-130E Hercules,5-122,4393,10,10,0,
03/03/1974,11:41,"Near Ermenonville, France",Turkish Airlines (THY),981,Paris - London,McDonnell Douglas DC-10-10,TC-JAV,46704/29,346,346,0,"The aircraft crashed shortly after takeoff from Orly Airport in Paris
03/08/1974,,"Hanoi, Vietnam",Pathet Lao Airlines,,,Antonov An-24,,,18,18,0,Fifiteen journalists aboard for an Asian tour.
03/11/1974,21:42,"Carson City, Nevada",Executive Air - Air Taxi,,"Carson City, NV - San Jose, CA",Robertson 414,N8118Q,,4,4
03/13/1974,19:28,"Bishop, California",Sierra PacifiAirlines,802,Bishop - Burbank,Convair CV-440,N4819C,138,36,36,0,"The aircraft crashed into Poleta Ridge
03/15/1974,08:07,"Tehran, Iran",Sterling Airways,,Tehran - Kobenhavn,Aerospatiale Caravelle 10B3,OY-STK,266,96,15,0,Collapse of right main landing gear while taxing ruptured the wing fuel tank causing a fire.
04/04/1974,02:35,"Francistown, Botswana",Wenela Air Services,,Francistown - Malawi,Douglas DC-4,A2-ZER,27242,84,78,0,The aircraft crashed into trees and burst into flames after the engines overheated resulting in loss of power. The plane was carrying gold miners. Fuel contamination. Jet A fuel contaminated the aviation gasoline.
04/11/1974,09:41,"Hilo Island, Hawaii",Island Air,,"Keahole, HI - Kahului, HI",Beechcraft H18S,N28358,,11,11
04/22/1974,15:26,"Grogak, Bali, Indonesia",Pan American World Airways,812,"Hong Kong - Bali, Indonesia - Sydney, Austrailia",Boeing B-707-321C,N446PA,19268/544,107
04/24/1974,,"Tashkent, Uzbekistan",Aeroflot,,,Ilyushin IL-18E,CCCP-75405,186009005,115,1,0,"The plane took off
04/27/1974,,"Near Leningrad, Russia",Aeroflot,,,Ilyushin IL-18B,CCCP-75559,184007703,118,118,0,The aircraft crashed after report of a heavy vibration and fire in the No. 4 engine. Structural failure of turbine disin No. 4 the engine.
04/30/1974,13:47,"Galveston, Texas",Houston Metro Airlines,,"Galveston, TX - Houston, TX",Beechcraft 99,N853SA,U-41,12,6
05/02/1974,19:30,"Banos, Ecuador",Aero Taxis Equatorianos,,Pastaza - Ambato,Douglas C-47,HC-AUC,,24,22,0,Struck a mountain shortly after takeoff. Failure to climb to the minimum safety altitude. Overconfidence of the crew. Distraction by a tourist guide in the cockpit.
05/06/1974,22:22,"Nurnberg, Germany",Fragtflug,,Nice - Nurnberg,Douglas DC-6A,TF-OAE,44069/396,3,3,0,The cargo plane struck trees and crashed while on final approach. Icing. Pilot blood alcohol above normal.
05/23/1974,16:55,"Springfield, Illinois",Saturn Airways,,"Alameda, CA - Indianapolis, IN",Lockheed L-100-30 Hercules,N14ST,4225,3,3
05/23/1974,,"Kiev, Ukraine, USSR",Aeroflot,,,Yakovlev YAK-40,CCCP-87579,9221122,29,29,0
05/31/1974,,"Rankin Inlet, Canada",Lambair,,,Bristol 170 Freighter 31E,CF-QWJ,13078,2,2,0,The cargo plane suffered an engine failure and spiraled into the ground.
06/08/1974,17:30,"Monte San Isidro,  Colombia",Aerolineas TAO,514,Bucaramanga - Cucuta,Vickers Viscount 785D,HK-1058,380,44,44,0,The aircraft lost control and crashed after a tailplane failure. Failure in-flight of the tailplane spar causing the left tailplane and elevator the detach.
06/27/1974,,"Battambang, Khmer Republic",Cambodia Air,1999,Battambang - Phnom Penh,Boeing 307B-1 Stratoliner,XW-TFR,1999,39,19,0,Crashed during takeoff and burned after 3 engines failed. Mechanical failure due to improper maintenance procedures. Insufficient training of cabin crew.
06/30/1974,13:00,"Umiat, Alaska",Alaska Helicopter - Air Taxi,,"Umiat, AK - Local",Fairchild Hiller FH1100,N8679,,5,5,0
07/24/1974,09:45,"Bogota, Colombia",Aeronorte Colombia,,,Douglas DC-4,HK-728,10507,3,3,0,"The cargo plane crashed into a mountain at 7
07/27/1974,,"Near MoHoa, Vietnam",Air Amercia,,Phnom Penh - Siagon,Fairchild C-123K,ST-4,20304,5,5,0,The cargo plane was struck by a surface-to-air missile.
08/05/1974,,"Mt. Apica, Canada",Laurentian Air Services,,LaTuque - St. Honore,Douglas DC-3,C-FTAT,11850,11,5,0,Struck high ground while attempting to land at St. Honore.
08/09/1974,,"Diemas, Syria",Military - Canadian Air Force,,"Beirut, Lebanon  - Damascas, Syria",de Havilland Canada DHC-5 Buffalo,115461,,9,9
08/11/1974,,"Near Ouagadougou, Upper Volta",Air  Mali,,"Bamako, Mali - Kano, Nigeria",Ilyushin IL-18B,TZ-ABE,181003304,60,47
08/12/1974,14:50,"Cali, Colombia",AVIANCA,,Tumaco - Bogota,Douglas C-47-DL,HK-508,4527,27,27,0,The crew became lost in rainy weather and crashed into Trujillo Mountain. Wreckage found 2 months later.
08/13/1974,18:35,"Anaktuvuk, Alaska",MerriAviation - Air Taxi,,"Dietrich, AK - Happy Valley, AK",de Havilland DHC-2,N7620,,4,4
08/14/1974,,"Margarita Island, Venezuela",Linea Aeropostal Venezolana,,Cumana - Porlamar,Vickers Viscount 749,YV-C-AMX,95,49,48,0,The flight crashed into La Gloria peak in a hurricane.
08/18/1974,,"Near La Paz, Bolivia",Military - U.S. Air Force,,"Howard AFB, Panama - La Paz, Bolivia",Lockheed C-141A,65-0274,300-6126,7,7
08/18/1974,,"Near Kisangani, Zaire",Military - Zairean Air Force,,,Lockheed C-130H,9T-TCD,4422,31,31,0,
09/07/1974,,"Tandjung-karang, Indonesia",Garuda Indonesia Airlines,,,Fokker F-27 Friendship 600,PK-GFJ,10422,39,35,0,Crashed into a building while landing during poor weather conditions. The plane was blown against the building by a strong gust of wind.
09/08/1974,09:40,"Ionian Sea , off Kefallinia, Greece",Trans World Airlines,841,Tel Aviv - Athens - Rome - New York,Boeing B-707-331B,N8734,20063/789,88,88,0
09/11/1974,07:34,"Near Charlotte, North Carolina",Eastern Air Lines,212,"Charleston, SC - Charlotte, NC - Chicago, IL",McDonnell Douglas DC-9-31,N8984E,47400/443,82
09/15/1974,11:00,"Phan Rang, Vietnam",Air Vietnam (South Vietnam),706,Da Nang - Saigon,Boeing B-727-121C,XV-NJC,19819,75,75,0,"Hijacked. Detonation of two hand grenades in the passenger compartment after the pilot refused to fly to Hanoi
09/19/1974,03:50,"Riverside, California",Riverside Air,,"Las Vegas, NV - Riverside, CA",Piper PA-32,N15528,,5,5
09/22/1974,09:55,"Fairbanks, Alaska",Frontier Flying Service - Air Taxi,,"Fairbanks, AK - Dietrich, AK",Cessna 185,N70026,,2,2
10/01/1974,21:40,"Lupine, Alaska",Winship Air Service,,"Fairbanks, AK - Lupine, AK",Volpar 18,N357V,,6,6
10/02/1974,19:30,"Off Saint Thomas, U.S. Virgin Islands",North Cay Airways,,Saint Croix - Saint Thomas,Britten-Norman BN-2A Islander,N864JA,175,2,2,0,Crashed into the ocean.
10/09/1974,,"Medfra, Alaska",Evergreen Helicopter - Air Taxi,,,Bell 205A,N2970W,,3,3,0,Main rotor separated due to overloading. Evidence of mast bumping. Improper operation of flight controls.
10/10/1974,,"Cairo, Egypt",EgyptAir,,Training,Tupolev Tu-154,SU-AXB,73A-048,6,6,0,The aircraft lost control while taking off and crashed. Pilot error. Stalled.
10/13/1974,,Formosa Strait,Military - U.S. Air Force,,,Lockheed WC-130H Hercules,65-0965,4106,6,6,0,Disappeared after flying into typhoon Bess.,
10/17/1974,08:50,"Kassan, Alaska",Webber Airlines -Air Taxi,,"Kassan, AK - Coffman Cove, AK",de Havilland DHC-2,N129WA,,8,5
10/19/1974,01:15,"Calapan, Philippines",Mabuhay Airways,,,Douglas DC-3,RP-C643,15551/26996,8,1,0,"One hour after takeoff
10/22/1974,18:25,"Fort Apache, Arizona",Deming Flying Service - Air Taxi,,"Kingman, AZ - Deming, NM",Cessna 172M,N20673,,2,2
10/24/1974,19:30,"Blair, Oklahoma",AltusFlying Service - Air Taxi,,"Dallas, TX - Altus, OK",Piper PA-31,N979L,,4,2
10/24/1974,06:35,"Chicao, Illinois",Henry Nichols - Air Taxi,,"Indianapolis, IN - Chicago, Il",Cessna 337D,N2HN,,3,2
11/09/1975,,"Willow, Alaska",Willow Air Service - Air Taxi,,"Willow, AK - Local",Piper PA-18,N2580P,,3,3,0
10/27/1974,23:36,"Old Man's Camp, Alaska",Alaska International Air,,Fairbanks - Bettles,Lockheed L-100 Hercules,N102AK,4234,4,4,0,"While en route
10/28/1974,16:45,"Pagosa Springs, Colorado",Hlavka Aviation - Air Taxi,,"Gallup, NM - Rapid City, SD",Beechcraft 95-B55,N414K,,2,2
10/30/1974,02:30,"Rae Point, Northwest Territories, Canada",Pan ArctiOil,416,,Lockheed 188PF Electra,C-FPAB,1141,34,32,0
11/07/1974,,"Off Sonderborg, Denmark",,,,Britten-Norman BN-2A Islander,OY-DVJ,154,3,3,0,Ditched into the ocean.
11/15/1974,13:00,"Hoonah, Alaska",Southeast Sky - Air Taxi,,"Juneau, AK - Tenakee, AK",de Havilland DHC-2,N97702Z,,4,4
11/15/1974,,"Manila, Philippines",Orient Air System and Integrated Services,,,Douglas C-47A-30,RP-C570,25452/14007,8,1,0,The No.2 prop was feathered when the engine failed after taking off. The aircraft lost altitude during a 180 degree turn and a forced landing was made in a rice field.
11/20/1974,,"Soddu, Ethiopia",Ethiopian Airlines,,Soddu - Beica,Douglas DC-3,ET-AAR,9465,24,2,0,Crashed on takoff.
11/20/1974,07:50,"Near Nairobi, Kenya",Lufthansa,540,Nairobi - Johannesburg,Boeing B-747-130,D-ABYB,19747/29,157,59,0,The aircraft stalled and crashed during takeoff. The wing flaps were not extended. First fatal Boeing 747 accident to occur.
11/22/1974,,"Barcelona, Spain",Alpa Servicios Aéreos,,,Cessna 500 Citation I,EC-CGG,500-0108,4,4,0,Crashed during takeoff.
12/01/1974,19:26,"Bear Mountain,  Thiells, New York",Northwest Orient Airlines,6231,"New York City, NY - Buffalo, NY",Boeing B-727-251,N274US,20296,3
12/01/1974,11:10,"Near Berryville, Virginia",Trans World Airlines,514,Columbus - Washington D.C.,Boeing B-727-231,N54328,20306/791,92,92,0,The plane crashed into high terrain at approximately 270 mph during an approach to Dulles Airport. The crew's decision to descend before aircraft reached the approach segment. The crew ignored high terrain marked on the en route chart and continued their descent. Lack of clarity in ATC procedures. The issuance of the approach clearance when the flight was 44 miles from the airport on an unpublished route without clearly defined minimum altitudes. Inadequate depiction of altitude restrictions on the profile view of the approach chart for the VOR/DME approach to Runway 12 at Dulles International Airport.
12/04/1974,22:15,"Near Maskeliya, Sri Lanka",Martinair Holland NV,,Surabaya - Jeddah,McDonnell Douglas DC-8-55F,PH-MHB,45818/242,191,191,0,The aircraft impacted high ground during approach. The crew descended below a safe altitude due to a position error resulting from misinterpretation of Doppler and weather radar.
12/11/1974,,"Near Old Harbors, Alaska",Kodiak Airways,,"Old Harbor, AK - Kodiac, AK",Grumman G-21,N1583V,1125,5,5
12/12/1974,,"Near MoHoa, South Vietnam",Military - Vietnamese Air Force,,,Boeing Vertol CH-47 (helicopter),,,54,54,0,Shot down by a surface-to-air missile.
12/14/1974,,"Bukhara, Uzbekistan",Aeroflot,,,Yakovlev 40,CCCP-87630,9131119,7,7,0,Overran the runway and hit a dyke while attempting to take off. Elevator lock not removed.
12/22/1974,12:30,"Maturin, Venezuela",Aerovias Venezolanas SA (Venezuela),358,,McDonnell Douglas DC-9-14,YV-C-AVM,47056/89,77,77,0,The flight crashed 5 minutes after taking off. Undetermined cause. Possible engine failure.
12/26/1974,18:05,"Riverton Heights, Washingon",Harbor Airlines - Air Taxi,,"Riverton Heights, WA - Oak Harbor, OR",Brittonorman BN-2A,N66HA,,6,4
12/29/1974,,"Carpathian Mts., near Sibiu, Romania",Tarom,,,Antonov AN-24RV,YR-AMD,27307606,33,33,0
01/03/1975,,"Moscow, Russia",Aeroflot,,,Tupolev TU-124,CCCP-45037,351002,61,61,0,Crashed shortly after taking off.
01/03/1975,,"Near Nha Trang, Vietnam",Air America,,Da Lat - Nha Trang,Fairchild C-123K,ST-1,20074,9,9,0,Shot down with a SAM missile.
01/05/1975,10:07,"Palmer, Washington",Richland Flying Service - Air Taxii,,"Richland, WA  - Seattle, WA",Cessna TU206D,N71972,,4,3
01/06/1975,,"Sierra del Aconquija, Argentina",Military - Argentine Navy,,,de Havilland Canada DHC-6 Twin Otter 200,AE-259,140,12,12,0,Flew into the side of a mountain in poor weather conditons.
01/08/1975,08:30,"Near Doncello, Colombia",SATENA,,San Vicente del Caguan - Florencia,Douglas DC-3,FAC-688,,21,21,0,Crashed and burned in mountains while en route. Improper flight planning by proceeding in mountainous terrain during adverse weather conditions which had reduced visibility along the route.
01/09/1975,16:07,"Whittier, California",Golden West Airlines / Private,261,Ontario - Los Angeles,de Hav Can. DHC-6 Tw Otter 100/ Cessna,N6383,83,14,14,0,"Midair collision between a DHC-6 and a Cessna 150 at 2
01/13/1975,17:00,"Juneau, Alaska",Channel Flying Service - Air Taxi,,"Juneau, AK - Return",de Havilland DHC-2,N1944,,5,5,0
01/15/1975,,"Budapest, Hunary",Malev Hungarian Airlines,,Berlin - Budapest,Ilyushin IL-18V,HA-MOH,184007104,9,9,0,"The aircraft crashed into the ground 1
01/16/1975,,"Sam Neva, Laos",Aeroflot,,,Antonov AN-12,,,16,16,0,
01/30/1975,,"Istanbul, Turkey",Turkish Airlines (THY),,Izmir - Istanbul,Fokker F-28 Fellowship 1000,TC-JAP,11058,42,42,0,"After an electrical failure at the airport the aircraft initiated a go-around. Because another aircraft was about to take off
01/30/1975,,"Santo Domingo, Dominican Republic",Linea Aérea Nacional,,Santo Domingo - Port-au-Prince,Douglas DC-3-313,HI-222,2189,30,1,0,Crashed during take off.
02/01/1975,,"Valdez, Alaska",Kenai Air Service - Air Taxi,,"Kenai, AK - Gulkana, AK",Piper PA-31,N54734,,2,2
02/01/1975,08:58,"Houston, Texas",Horizon Properties,,"Lawton, OK - Huntsville, TX",Douglas DC-3C,N15HC,43080,16,5
02/03/1975,23:10,"Manila, Philippines",Philippine Air Lines,,Manila - Iligan,Hawker Siddeley HS-748 2,RP-C1028,1590,33,32,0,The No. 2 engine caught fire shortly after takeoff.  The aircraft crashed into a rice field 3 miles short of the runway while making an emergency approach back to the airport.
02/09/1975,,"Souda, Crete",Military - Deutsche Luftwaffe,,,Transall C-160,5063,D-85,40,40,0,"Slammed into a mountain at an altitude of 5
02/16/1975,19:00,"Fairbanks, Alaska",PacifiAlaska Airlines,,Fairbanks - Happy Valley Camp,Douglas DC-6BF,N77DG,43520/222,3,3,0,The cargo plane lost three of four engines on takeoff. The crew tried to return to the airport but crashed short of the runway. Fuel contamination. Water in fuel.
02/22/1975,22:12,"Medellin, Colombia",Aerocondor,,"Medellin, Colombia - Miami, Florida",Canadair CL-44,HK-1972,,5,5
02/27/1975,,"Near Sao Paulo, Brazil",VASP,,Sao Paulo - Bauru,Embraer 110C Bandeirante,PP-SBE,110021,15,15,0,"The plane crashed into houses after taking off and burst into flames. The plane had engine trouble
03/05/1975,16:18,"Waterford, Wisconsin",Burlington Air - Air Taxi,,"Moline, IL - Racine IL",Beechcraft 95,N2061C,,4,2,0
03/12/1975,18:00,"Pleiku, South Vietnam",Air Vietnam (South Vietnam),,,Douglas DC-4,XV-NUJ,10701,26,26,0,Shot down by a hand-held surface-to-air missile by North Vietnamese forces 25 miles SW of Pleiku.
03/16/1975,13:40,"Near Barito, Argentina",Military - Argentine Air Force,,El Palomar AB - San Carlos de Bariloche,Fokker F-27 Friendship 400M,TC-72,10404,55,55,0,The aircraft struck a mountain while preparing for an ILS approach in poor weather. Crew error. Crew descended below the minimum safe altitude before knowing their position.
03/18/1975,,"Singa, Sudan",Sudan Airways,,,de Havilland Canada DHC-6 Twin Otter 100,ST-ADB,85,6,5,0,
03/20/1975,23:00,"Near Quilcene, Washington",Military - U.S. Air Force,,Clark AFB - Japan,Lockheed C-141A (L.300),64-0641,6054,16,16,0,The aircraft struck a ridge of  Mt. Constance in OlympiNational Park. Faulty clearance by the ATC after misidentifying the C-141 as another aircraft.
04/04/1975,16:30,"Saigon, Vietnam",Military - U.S. Air Force,,Tan Son AFB - Clark AFB,Lockheed C-5A Galaxy,68-218,21,330,155,0,"The aircraft reported it was returning to Tan Son Nhut Airbase 15 minutes after taking off. The aircraft was not able to make the airport and crashed landed into a rice paddy
04/22/1975,13:42,"Goleta, California",Skips Air Service - Air Taxi,,"Fresno, CA - Santa Barbara, CA",Cessna 310Q,N7634Q,,3,3
04/28/1975,23:00,"Deadhorse, Alaska",Gay Airways - Air Taxi,,"Anaktuvak, AK - Deadhorse, AK",Bell 206,N59521,,4,2
05/03/1975,,"Near Sardinata, Colombia",SATENA,,Ocana - Cucuta,Douglas DC-3,FAC- 663,,6,3,0,Crashed  on its inaugural flight.
05/10/1975,,"Off Cape Paterson, Australia",Air Express,,,Bristol 170 Freighter 21E,VH-SJQ,12807,2,2,0,Following an engine failure the cargo plane could not maintain altitude and crashed into the ocean.
05/12/1975,17:45,"Savoonga, Alaska",Foster Aviation,,"Savoonga, AK - Gambell, AK",Piper PA-23-250,N5067Y,27-2081,6,6
05/13/1975,21:15,"Near Sakon Nakhon, Thailand",Military - U.S. Air Force,,Nakhom Phanom AB - Utapao AB,Sikorsky CH-53C (helicopter),68-10933,,23,23,0,The copter was observed in an uncontrollable descent to earth in an inverted attitude after which it crashed and burned. Cracking of a rotor spindle assembly  which led to separation of the main rotor.
06/03/1975,,"Manila, Philippines",Philippine Air Lines,,Legaspi - Manilla,BAC One-Eleven 524FF,RP-C1184,190,64,1,0,A bomb exploded in the right rear lavatory causing a hole in the fuselage. The plane landed safely.
06/17/1975,,"Pedro Alfonso, Brazil",Varig,,,Hawker Siddeley HS-748-235 Srs. 2A,PP-VDN,1625,15,1,3,"The aircraft landed with excessive speed and touched down on the last 300 meters of the runway
06/24/1975,16:05,"JFK Airport, New York, New York",Eastern Air Lines,66,New Orleans - New York City,Boeing B-727-225,N8845E,20443/837,124,113,0
06/26/1975,22:28,"Toledo, Ohio",Hamilton Aviation,,"Detroit, MI - Peducah, KY",Beechcraft E18S,N791A,,2,2
06/30/1975,19:30,"Near Saravena, Colombia",Taxi Aereo El Venado,,Cucuta - Tame,Douglas DC-4,HK-1309,10403,3,3,0,The cargo plane crashed en route.
07/02/1975,,"Nantes, France",Touraine Air Transport,,Nantes - Brest,Beechcraft 99,F-BTQE,U- 61,8,8,0,Crashed on takeoff after engine failure in the No. 2 engine.
