09/12/1990,,"Off Sondre Stromfjord, Greenland",Nuna Air,,Sondre Stomfjord - Goose Bay,Cessna 441 Conquest II,OY-CGM,229,8,8,0,"Crashed into the sea 80nm southwest of its departure point. According to ATC tapes
09/14/1990,,"Koltsovo, Russia",Aeroflot,,Volgograd - Sverdlovsk,Yakovlev YAK-42,CCCP-42351,1811379,129,4,0,"The aircraft undershot on approach and crashed 1
09/20/1990,,"Off Fernando de Noronha, Brazil",SUDENE,,Fernando de Noronha -  Recife,Embraer 110P1 Bandeirante,PT-FAW,110368,12,12,0,"The predeparture check lists were carried out by the first officer
09/24/1990,07:02,"San Luis Obispo, California",HiTech Helicopters,,"Van Nuys, CA - San Luis Obispo, CA",Cessna 501 Citation,N79DD,500-0254,4,4
10/02/1990,,"Near Kuwait City, Kuwait",Iraqi Airways,,,Ilyushin IL-76,,,130,130,0,The aircraft was shot down by a Kuwaiti fighter shortly after takeoff with an air-to-air missile. Mostly military personnel were onboard.
10/02/1990,09:15,"Guangzhou, China",China Southwest Airlines / Xiamen Airlines,8301/,Guangzhou - Shanghi,Boeing B-737-247 / Boeing B-757-21B,B-2812/B-2510,24758 / 23189,226,128,0,"Shortly after taking off a hijacker entered the cockpit and demanded to be flown to Hong Kong. The captain circled for 30 minutes and after a struggle in the cockpit
10/03/1990,20:08,"Cape Canaveral, Florida",Eastern Air Lines,791,,McDonnell Douglas DC-9-31,N8923E,45838/104,97,1,0,The aircraft experienced severe turbulence after entering overhang of a thunderstorm at FL 310. Three passengers received serious injuries. One passenger died 20 days after the accident. Failure of the captain to follow procedures by allowing the aircraft to continue into the overhang anvil of a thunderstorm. Failure of the passengers to abide by instructions concerning the use of seat belts. Failure of the flight attendants to enforce the use of seat belts.
10/19/1990,15:25,"Near Bella Vista, Bolivia",BAFIN,,Bella Vista - La Paz,Douglas C-47B-40-DK,CP-735,15805/33553,4,4,0,Disappeared en route. Wreckage found 6 years later in the Andes.
10/24/1990,01:58,"Santiago de Cuba, Cuba",Cubana de Aviacion,2886,Camaguey - Santiago de Cuba,Yakovlev YAK-40,CU-T1202,9631449,31,11,0,Struck the ground 2.5 miles short of the runway at a high rate of speed in rain and reduced visibility. Pilot error. Continuing VFR flight in IFR conditions.
11/11/1990,,"Novossibirsk, Russia",MAP - Ministerstvo Aviatsionnoi Promyshlennosti,,,Antonov AN-8,CCCP-69320,0B-3420,10,9,0,The cargo plane crashed after both engines flamed out during an approach to land.
11/14/1990,19:11,"Stadelberg, Switzerland",Alitalia,404,Milano - Zürich,McDonnell Douglas DC-9-32,I-ATJA,47641/746,46,46,0,"The aircraft continued to descend after intercepting the glide slope and hit high ground 6 miles from the airport. False indication of VHF NAV on unit No.1 in the aircraft. Possible misread altimeter by the pilot-in-command. Lack of GPWS warning in the cockpit. Crew was not aware of the possibility of incorrect indications in the NAV equipment in use. Non-compliance with basiprocedural instructions during the approach. ATC  did not observe the leaving of the cleared altitude of 4
11/18/1990,,"Near Medellin, Colombia",SATENA,,,CASA 212 Aviocar 200,FAC-1150,303,16,16,0,"Crashed into a jungle mountain
11/19/1990,,"Near Ashkhabad, Turkmenistan, USSR",Aeroflot,,,Mil Mi-8T,CCCP-22389,,15,15,0
02/17/1991,00:20,"Cleveland, Ohio",Ryan International Airlines,590,Cleveland - Indianapolis,McDonnell Douglas DC-9-15RC,N565PC,47240/346,2,2,0,"The cargo plane stalled during takeoff cart wheeled and crashed. The failure of the flight crew to detect and remove ice contamination on the airplane's wings
11/21/1990,11:15,"Koh Samui, Thailand",Bangkok Airways,125,Bangkok - Koh Samui,de Havilland Canada DHC-8-103,OB-1358,T210-63675,38,38,0,"After receiving a runway change
11/25/1990,,"Off Ravenna, Italy",Eitos,,,Aerospatiale 330J Puma,I-EHPA,1133,13,13,0,The helicopter crashed into the sea during a storm.
12/03/1990,13:45,"Romulus, Michigan",Northwest Airlines/ Northwest Airlines,299/1482,Detroit - Pittsburg,Boeing B-727-251 / MD Douglas DC-9-14,N278US/N3313L,21157 / 45708/77,198,8,0,Ground collision in dense fog. The 727 was on its takeoff roll when the DC-9 taxied onto the active runway. Improper crew coordination aboard the DC-9.  Failure to stop and alert ATC of positional uncertainty. Eight killed aboard the DC-9. None aboard the B-727.
12/04/1990,,"Nairobi, Kenya",Sudania Air Cargo,,,Boeing B-707-320F,ST-SAC,19377/666,10,10,0,"Undershot the runway by 4km on a second approach
12/06/1990,,"Near Matak, Indonesia",Pelita Air Service,,,IPTN 332C Super Puma,PK-PUI,NSP4/2022,12,10,0,The helicopter crashed into the sea.
12/21/1990,12:20,"Near False Pass, Alaska",MarkAir Commuter,,Cold Bay - False Pass,Cessna 208 Caravan I,N9444F,208-00104,1,1,0,The cargo plane crashed into mountains while approaching False Pass. The pilot's improper decision to continue flight into an area of mountainous terrain and adverse weather conditions. the terrain and weather were factors.
01/10/1991,18:00,"Near Paramo Mucuti, Venezuela",Military - Venezuelan Navy,,Caracas - Merida,CASA 212 Aviocar 200,ARV-0209,264,22,21,0,"Crashed into Paramo Mucuti Mountain
01/11/1991,,"Near Belo Horizonte, Brazil",Belair - Air Taxi,,,Learjet 25C,PT-KKV,25-172,5,5,0,Crashed in a rainstorm.
01/30/1991,13:00,"Jalaludin, Indonesia",Merpati Nusantara Airlines,,,CASA 212 Aviocar 200,PK-NCY,258/78N,21,1,0,The plane made a forced landing during poor weather conditions and crashed into trees on a ridge. All passengers survived but one elderly passenger died while waiting for rescue.
01/31/1991,,"Near Ras Al Khafji, Saudi Arabia",Lockheed AC-130H Hercules,,,Military - U.S. Air Force,69-6567,4341,13,13,0,Shot down by a surface-to-air missile during operation Desert Storm.
02/01/1991,18:07,"LAX, Los Angeles, California",USAir / Skywest Airlilnes,1493/5569,Columbus - Los Angeles \  Los Angeles - Fresno,Boeing B-737-300 / Swearingen SA-227AC,N388US/N683AV,23310/1145 / AC-683,99,34,0
02/05/1991,,"Near Nea Ankhialos, Greece",Military - HelleniAir Force,,,Lockheed C-130H,748,4724,63,63,0,"The aircraft flew into the summit of Mt. Billiuras at 4
02/07/1991,08:00,"Munford, Alabama",Macon Horizons - Air Taxi,,"Macon, GA - Anniston, AL",Piper PA-31-350,N27818,31-7952001,4,4
02/13/1991,17:41,"Aspen, Colorado",Air Taxi - Richmor Aviation,,"Las Vegas, NV - Aspen, CO",Learjet35A,N535PC,291,3,3
02/14/1991,,"Near Taisha, Ecuador",Military - Ecuadorean Air Force,,Macao - Taisha,de Havilland Canada DHC-6 Twin Otter 300,FAE447,832,22,22,0,"Crashed into the side of Mt. Paso Macunaa at 5
02/20/1991,15:24,"Puerto Williams, Chile",LAN,,Punta Arenas - Puerto Williams,British Aerospace BAE-146-200A,CC-CET,E-2061,72,20,0,The plane overran the runway on approach and sank in Beagle Channel in the sea.
03/03/1991,09:44,"Near Colorado Springs, Colorado",United Air Lines,585,Denver - Colorado Springs,Boeing B-737-291,N999UA,22742/875,25,25,0,"While on final approach to Colorado Springs
03/05/1991,16:15,"La Puerta, Venezuela",Linea Aeropostal Venezolana,108,Maracaibo - Santa Barbara de Zulia,McDonnell Douglas DC-9-32,YV-23C,47720/846,45,45,0,The aircraft crashed into the Las Torres plateau in the Andes mountains on a flight from Maracaibo to Santa Barbara de Zulia. The mountain was shrouded in clouds. Controlled flight into terrain. The point of impact was considerably off course.
03/11/1991,08:40,"Hassfurt, Germany",Luft-Taxi Emsland,,,Cessna 402B,D-ICLW,402B-0859,7,6,0,Crashed while attempting a VOR/DME approach in fog. Pilot attempted to use a VOR 33km from the airport.
03/16/1991,01:43,"San Diego, CA",Duncan Aircraft Sales,,"San Diego - Amarillo, TX  - Evansville, IN",Hawker-Siddeley DH-125-1A/522,N831LC,25095,10,10
03/16/1991,,"Malanje, Angola",Transafrik,,,Lockheed L-100-30 Hercules,CP-1564,4833,9,9,0,The cargo plane was shot down by a surface-to-air missile.
03/18/1991,,"Brasillia, Brazil",Conesul Taxi Aéreo,,Ubrraba - Brasillia,Gates Learjet 25,PT-LLL,25D-258,7,7,0,Crashed 8km short of the runway in darkness.
03/18/1991,,"Treasure Cay, Bahamas",Broward Aviation Services - Air Taxi,,,Cessna 402C,N5785C,402C0043,5,5,0,Crashed while on approach.
03/21/1991,,"Ras-al-Mishab, Saudi Arabia",Military - Royal Saudi Air Force,,,Lockheed C-130H,469,4754,98,98,0,Crashed while attempting to land in poor visibility caused by oil fires during the Persian Gulf War.
03/21/1991,02:15,"Off San Diego, California",Military - U.S. Navy / Military -  U.S. Navy,,,Lockheed P-3C / Lockheed P-3C,158930/159325,,27,27,0,"The two aircraft collided at an altitude of 3
03/23/1991,11:37,"Navoi,  Uzbekistan",Uzbek Civil Aviation Administration,,Trashkent - Navoi,Antonov AN-24B,CCCP-46472,27307910,63,34,0,The aircraft overran the runway and crashed into concrete blocks.
03/25/1991,08:15,"Near Bangalore, India",Military - Indian Air Force,,,Hindustan Aeronautics 748-2,,,28,28,0,The plane climbed to an altitude of 150 ft. and then crashed into the ground about half-a-mile from the airport. Engine failure.
04/01/1991,15:00,"Off San Pedro, Belize",TropiAir - Air Taxi,,Zeldiver - San Pedro,Cessna 402B,N402BL,402B0827,8,8,0,The air taxi crashed into the Caribbean.
04/04/1991,13:40,"Lake Thutade, Canada",Central Mountain Air Services,,Sturdee - Smithers,Douglas C-47B-15-DK,C-FQNF,26643,7,6,0,"The plane crash landed on a frozen lake after the crew flighing VFR
04/04/1991,12:10,"Marion, Pennsylvania",Private,,"Williamsport, PA  - Philadelphia, PA",Piper Aerostar 601 / Bell 412SP,N3645D / N78S,6108448162153/0151,5,5
04/05/1991,14:51,"Brunswick, Georgia",AtlantiSoutheast Airlines,2311,Atlanta - Brunswick,Embraer 120RT- Brasilia,N270AS,120-218,23,23,0,"Just after turning onto final approach
04/19/1991,11:56,"Off Nuka Hiva, French Polynesia",Air Tahiti,,Hiva Ou - Nuku Hiva,Dornier Do-228-212,F-OHAB,8196,22,11,0,Crashed into the sea after taking off from Hiva Ou and experiencing engine failure. The crew didn't recognize the failure and concentrated on the low oil pressure warning. The approach was abandoned at the very last moment it was decided to carry out an unprepared ditching. The crew's performance may have been impacted by alcohol consumption.
05/05/1991,,"Near Awell, Sudan",Nile Safaris Aviation,,,Cessna 404 Titan II,ST-AHX,404-0657,8,8,0,Shot down by Sudan People's Liberation Army.
05/09/1991,,"Sulawesi, Indonesia",Merpati Nusantara Airlines,7533,Ambon - Ternate - Manado,Fokker F-27 Friendship 600,PK-MFD,10399,13,13,0,Crashed into Mt. Klabat in heavy fog while descending for a landing.
05/13/1991,13:19,"Grand Canyon, Airzona",Air Taxi - Air Grand Canyon Inc.,,Local sightseeing,Cessna 207A,N6280H,20700463,7,7,0,"The airplane crashed into a wooded area about 8 minutes after takeoff. Detonation (or pre-ignition) in the number 1 cylinder
05/15/1991,,"La Poyatta, Colombia",ADES Colombia,,Villavicencio - Miraflores Guaviarel,Douglas C-47B,HK-3177,26775,14,13,0,Eight minutes after takeoff the No. 2 engine failed.  The pilot turned back but crashed 1 mile short of the runway.  The passengers were told to throw out cargo after which unfortunately they all moved towards the tail leading to a loss of control.
05/23/1991,13:06,"Leningrad, USSR",Aeroflot,,Sukhumi - Leningrad,Tupolev TU-154B-1,CCCP-85097,97,181,13,0,"Undershot the runway and broke in half after a hard landing. Crew error. A rapid rate of descent
05/24/1991,,"Bakhtaran, Iran",Metro Cargo,,,Ilyushin 76TD,LZ-INK,93494835,10,4,0,After three missed approaches the cargo plane ran out of fuel and crashed.
05/26/1991,23:17,"Near Ban Nong Rong, Thailand",Lauda Air,4,"Bangkok - Wien, Austria",Boeing B-767-3Z9ER,OE-LAV,24628/283,223,223,0
06/01/1991,10:16,"Off Matthewtown, Great Inagua",Agape Flight Inc.,90,"Grada Zuma, Bahamas - Cape Hatien",GAF Nomad N24A,N8071L,44,3,2,0
06/10/1991,15:40,"Luanda, Angola",Carib Air Transport,,Luanda - Cafunfo,Lockheed L-382B Hercules,J6-SLQ,3099,7,7,0,Crashed on takeoff after the No. 1engine overspeeded and failed.
06/20/1991,03:45,"Near Malambo, Colombia",Aerosucre Colombia,,Bogota - Malambo,Douglas DC-6BF,HK-3511,45132/801,18,2,0,Following several attempts to land the pilot decided to hold until weather conditions improved.  Contact was lost with the plane and it flew into the ground. Visibility was reduced by low lying fog.
06/26/1991,,"Gulf of Finland, Russia",Aeroflot,,Saint Petersburg - Voronezh,Antonov AN-24,CCCP-46724,7300304,10,10,0,The cargo plane crashed into the Gulf of Finland shortly after taking off.
06/26/1991,21:00,"Near Sokotu, Nigeria",Okada Air,,Benin - Kano,BAC One-Eleven 402AP,5N-AOW,94,53,4,0,"The plane diverted to Sokotu due to poor weather. After circling for an hour
07/04/1991,09:10,"El Yopal, Colombia",Helicol Colombia,,,de Havilland Canada DHC-6 Twin Otter 300,HK-2889X,606,3,3,0,While attempting to land the pilot continued VFR flight in IFR conditions and collided with a hill.
07/09/1991,,"Bellavista Airport, Peru",Aerochasqui,,,CASA 212 Aviocar 200,OB-1218,232,15,15,0,The aircraft was shot at by drunken police in an attempt to stop it for a search when mistaken for drug smuggling. As the plane ascended through 75 ft. bullets penetrated the forward fuselage killing the pilot and copilot.
07/10/1991,18:12,"Birmingham, Alabama",L'Express Airlines,508,New Orleans - Mobile - Birmingham,Beechcraft BE-99-C99,N7217L,U226,15,13,0,"While the aircraft was on approach
07/11/1991,08:40,"Jeddah, Saudi Arabia",Nationair (chartered by Nigeria Airways),2120,Jeddah - Sokoto,McDonnell Douglas DC-8 Super 61,C-GMXQ,45982/345,261,261,0,"After taking off
09/27/1991,,"Guadalcanal Island, Solomon Islands",Solomon Islands Airlines,,Kira-Kira - Honiara,de Havilland Canada DHC-6 Twin Otter 300,H4-SIA,271,15,15,0,"Crashed into Mt. Nashua at 4
07/22/1991,21:15,"Detroit, Michigan",Jetstream Inc.,,Detroit - Chicago,Learjet 23,N959SC,23-045,3,3,0,"The plane
07/23/1991,09:30,"Salmon, Idaho",Air Taxi -Wilderness Aviation Inc.,,Local flight - Flying B Ranch,Cessna 206,N5183U,2060183,5,5,0,"The pilot of the Cessna 206 air taxi flight crashed while maneuvering during climbout after takeoff from the remote mountain airstrip. Witnesses stated the pilot attempted a turn in the narrow confines of the canyon. They observed the right wing drop a few feet while in a steep left turn
07/25/1991,,"Espiritu Santos, Vanuatu",Vanair,,Nogougou - Luganville,Britten-Norman BN-2A-6 Islander,YJ-RV4,220,9,9,0,Flew into a hillside 7 minutes after taking off from Nogougou. Spatial disorientation.
08/06/1991,,"Rarotonga, Cook Islands",Avalki Air,,Altukaki - Rarotonga,Britten-Norman BN-2A-6 Islander,DQ-FCN,676,10,6,0,Ditched into the sea while on approach.
08/14/1991,,"Near Uricani, Romania",Tarom,,Bucharest - Timisoara,Ilyushin IL-18V,YR-IMH,185008301,9,9,0,The cargo plane crashed in a rainstorm.
08/14/1991,19:00,"Gustavus, Alaska",Air Taxi - Haines Airways Inc.,,"Gustavus, AK - Haines, AK",Piper PA-32,N4075W,3240115,6,6
08/15/1991,,,Transports Aériens de la Guinee-Bissau,,Kano - Bamako,Fokker F-27 Friendship 100,J5-GBB,10119,3,3,0,On a positioning flight the plane struck trees and broke up while attempting to land.,
08/16/1991,01:55,"Imphal, India",Indian Airlines,257,Calcutta - Imphal,Boeing B-737-2A8,VT-EFL,21497,69,69,0,Crashed into high ground during approach to Imphal. The crew failed to follow the correct approach course.
08/20/1991,13:15,"Ketchikan, Alaska",Temsco Airlines,,"Ketchikan, AK - Wrangell, AK",Britten-Norman BN-2A-6 Islander,N68HA,2009,4,4
08/28/1991,23:59,"Walton, Oregon",Air Taxi - Bohemia Inc.,,,Aerospatiale 350B1,N64SF,,3,3,0,"While maneuvering in remote mountainous terrain
09/03/1991,,"Long Seridan, Malaysia",Airtech Rajawaldi Udara,,Bario - Marudi,Shorts SC-7 Skyvan 3-100,9M-AZB,SH-1975,20,14,0,Crashed into the jungle after double engine failure. Both engines didn't develop full power and were feathered on impact.
09/03/1991,,"Sampit, Indonesia",Dirgantara Air Services,,Sampit - Plangkaraya,Britten-Norman BN-2A-21,PK-VIP,752,10,3,0,Shortly after takeoff the left engine failed. The aircraft began to lose height in a left turn and crashed along the banks of Mentaya River.
09/11/1991,10:03,"Near Eagle Lake, Texas",Continental Express,2574,Laredo - Houston,Embraer 120RT Brasilia,N33701,120-077,14,14,0,In-flight loss of the left horizontal stabilizer. Forty-seven screw fasteners that would have attached the upper surface of the leading edge assembly for the left side of the horizontal stabilizer were missing. Lack of compliance with FAA approved maintenance procedures.
09/16/1991,,"Petropavlosk, USSR",Aeroflot,,,Antonov AN-72,CCCP-74002,SU002,13,13,0,"The cargo plane struck trees
09/16/1991,,"Baranquilla, Colombia",Lineas Aéreas Colombianas,,,Handley Page Dart Herald 400,HK-2701,178,7,7,0,"During a VOR approach
09/17/1991,,,Ethiopian Airlines,,,Lockheed L-100-30 Hercules,ET-AJL,5029,4,4,0,After experiencing a nose gear problem and attempting to return to the airport the cargo plane made a premature descent and struck Mount Arey.,
09/18/1991,21:55,"Belvedere Center, Vermont",Canair Cargo,,Moncton - Hamilton,Convair CV-580,C-FICA,98,2,2,0,"The cargo plane lost control and crashed into a mountainside while en route. Failure of the first officer to maintain control of the aircraft after becoming spatially disoriented and his exceeding the design stress limits of the aircraft. Factors related to the accident were: the lack of two pilots in the cockpit
09/23/1991,,"Khatanga, Russia",Aeroflot,,,Antonov 12BP,CCCP-13320,7345407,16,1,0,"Lost engine power due to fuel exhaustion during approach and made a forced landing 1
09/26/1991,,"Off St. Petersburg, USSR",Aeroflot,,,Antonov AN-26,CCCP-46724,AN24021,10,10,0,Crashed into the Gulf of Finland 5 minutes after taking  offsea after taking off.
09/29/1991,,"Near Villavicencio,  Colombia",CORAL Colombia,,,Curtiss C-46A,HK-3238,30268,10,1,0,The pilot tried to make an emergency landing back at the airport when the No. 2 engine began to overspeed. A belly landing was made in a field and the aircraft broke up and caught fire.
10/05/1991,15:00,"Condet, Indonesia",Military - Indonesian Air Force,,,Lockheed C-130H-30,A-1324,4927,135,134,1,The aircraft crashed into buildings during an attempted emergency landing after an engine caught fire shortly after taking off.
10/08/1991,,"Katapang, Indonesia",Deraya Air Taxi,,,Cessna 402A,PK-WWE,402-0002,9,1,0,Crashed while on approach.
10/13/1991,,"Aponguao Falls, Venezuela",EDELCA,,Kavanayen - Luepa,Bell 214 ST,YV-O-CVG-4,28181,12,12,0,"The helicopter was destroyed when it struck Kumaraden Hill at 4
10/25/1991,,"Tumbang Miri, Indonesia",Bali International Air Service,,Palangkaraya - Sampit,Britten-Norman BN2A-III-2 Trislander,PK-KTC,1017,17,17,0,The plane was not able to land at Sampit due to smoke and haze.  The plane held for 3 hours waiting for an improvement after which contact was lost.  The plane was never found.
10/25/1991,21:56,"Vallejo, California",Corporate Mobility Inc. - Private,,"Concord, CA - Novato, CA",Bell 206B helicopter,N3456M,1391,3,3
10/30/1991,14:30,"Near Point Alert, Ellesmere Island, NWT,Canada",Military - Royal Canadian Air Force,,Edmonton - Point Alert,Lockheed CC-130E,130322,4192,18,5
11/01/1991,,"Near Karakent, USSR",Military - Azerbaijan Air Force,,,Mil Mi-8 (helicopter),,,40,40,0,Shot down by rebel forces.
11/07/1991,,"Makhackala, Russia",Aeroflot,,Ellsta - Makhackala,Yakovlev YAK-40,CCCP-87526,9520841,51,51,0,Crashed into a mountain during daytime in poor weather. Failure of the crew to follow the correct approach path.
11/11/1991,18:50,"Recife, Brazil",Nordeste Linhas Aereas,,,Embraer 110P1 Bandeirante,PT-SCU,110-314,15,15,2,Crashed on takeoff hitting power lines and roof tops before coming to rest in a market square. Uncontained failure of the right engine.
11/16/1991,06:10,"Off Destin, Florida",Baron Aviation,,Memphis - Destin,Cessna 208B Caravan I Super Cargomaster,N951FE,208B-0058,1,1,0,Crashed into the water while on approach. The pilots failure to follow instrument flight rules procedures by disregarding the minimum descent altitude for the approach and failing to maintain clearance from the terrain. A factor in the accident was the pilot's over confidence in his personal ability.
11/16/1991,,"Anderma, Russia",Aeroflot,,,Antonov AN-12V,,,20,20,0,Crash landed in poor weather conditions. Icing.
11/20/1991,,"Nagoro-Karabak, USSR",Military - Soviet Air Force,,,Mil Mi-8 (helicopter),,,23,23,0,Crashed into a mountain in zero visibility.
11/20/1991,18:14,"Davis, California",Air Taxi - Airis Helicopters Inc.,,"San Francisco, CA - Sacramento, CA",Bell 206B,N5011K,2580,3,3
11/21/1991,,"Khodzhavend, Russia",Azerbaijani Airlines,,,Yakovlev YAK-40,,,20,20,0,
11/25/1991,15:00,"Sena, Mozambique",STASA,,,Douglas C-47B-DK,C9-STD,25471,3,1,0,The cargo plane overshot the runway and crashed into trees.
11/26/1991,05:02,"Near Bugulma, Russia",Tartarstan Airlines,,Nizhnevartovsk - Bugulma,Antonov AN-24,CCCP-47823,17307204,41,41,0,"While on approach to Bugulma
11/29/1991,,"Guaratingueta AB, Brazil",Military - Força Aérea Brasileira,,Brasilla  - Guarantinguerta,Embraer C-95C Bandeirante,FAB2333,110473,20,20,0,Flew into the side of a hill towards the end of the flight while flying VOR.  The crew flew along the wrong valley.
12/10/1991,16:42,"Near  Las Vegas, Nevada",Las Vegas Airlines,,"Grand Canyon, AZ - Las Vegas, NV",Piper PA-31-350 Navajo,N350MR,31-7652100,5,5
12/11/1991,09:41,"Rome, Georgia",Bruno Air,,"Rome, GA - Huntsville, AL",BeechJet 400,N25BR,RJ-57,9,9
12/22/1991,11:37,"Heidelberg, Germany",ClassiWings,,Frankfurt - Frankfurt,Douglas DC-3A,D-CCCC,7353,30,27,0,"The sightseeing tour struck a hill at 2
12/27/1991,08:51,"Stockholm, Sweden",Scandinavian Airlines (SAS),751,Stockholm-Copenhagen-Warsaw,MDonnell Douglas MD-81,OY-KHO,53003,129,0,0,"The aircraft reached an altitude of 3
12/27/1991,,"Massai Marra, Kenya",Eagle Aviation,,,Piper PA-31-350 Navajo,5Y-SRV,31-7300902,5,5,0,Crashed after colliding with a vulture.
12/29/1991,15:05,"Wanli, Taiwan",China Airlines (Taiwan),358,Taipei - Anchorage,Boeing B-747-2R7F,B-198,22390,5,5,0,The cargo plane crashed on takeoff  after losing the No. 3 and 4 engines due to corroded midspar fuse pins. The No. 3 engine broke loose first striking the No. 4 engine.
01/03/1992,05:46,"Gabriels, New York",Commutair,4821,"Plattsburgh, NY - SaranaLake, NY",Beechcraft 1900C,N55000,UC-135,4,2
01/13/1992,15:50,"Temple Bar, Arizona",Air Taxi - Air Vegas Inc.,,"Grand Canyon, AZ - Las Vegas, NV",Cessna T210L,N22592,21059763,5,2
01/20/1992,19:20,"Mt. Saint-Odile, near Strasbourg, France",Air Inter,148,Lyon - Strasbourg,Airbus A320-111,F-GGED,15,96,87,0
01/27/1992,,"Nanaimo, British Columbia, Canada",Air Rainbow,,Nanaimo - Port Mellon,Beech C18S,C-FRVR,43-35632,9,7,0
01/28/1992,16:20,"Near Stepanakert, Azerbaijan",Military - Azerbaijan Air Force,,Agdam - Shusha,Mil Mi-8 (helicopter),,,47,47,0,Exploded and crashed after being hit by a surface-to-air missile. Highest death toll in a commercial helicopter crash in aviation history.
02/03/1992,11:20,"Caetite, Brazil",Nordeste Linhas Aéreas,,Salvador - Guanambi,Embraer 110C Bandeirante,PT-TBB,110-005,12,12,0,The aircraft descended below MDA in poor weather and struck Taquari Hill which was obscured by clouds.
02/06/1992,09:48,"Evansville, Indiana",Military - U.S. Air Force,,Training,Lockheed C-130B,58-0732,3527,5,5,11,"The crew were doing touch-and-goes. Operating as the Kentucky National Guard
02/09/1992,05:15,"Near Kafountine, Senegal",Gambcrest,,Dakar - Yoff - Cap Skiring,Convair CV- 640,N862FW,9,56,30,0,The aircraft crashed into trees during its approach. The crew mistook the hotel lights for runway lights. Pilot error and malfunctioning equipment. Founder of Club Med and his son convicted of involuntary manslaughter in connection with this accident.
02/15/1992,03:26,"Toledo, Ohio",ATI,805,Seattle - Toledo,McDonnell Douglas DC-8-63F,N794AL,45923/383,4,3,0,"After a missed approach by the copilot the captain took over but also executed a go-around.  He became spatially disoriented. When in a low nose and left bank attitude
02/20/1992,,En route from Argentina  to  California,Aerolineas Argentinas,386,,Boeing B-747,,,,1,0,A passenger died of cholera while en route.,
03/02/1992,16:05,"Beni, Bolivia",Frigorifico Santa Rita,,Estencia el Trompillo - La Paz,Curtiss C-46T,CP-754,22570,5,5,0,"The cargo plane failed to gain altitude
03/12/1992,,"Etsouali, Congo",Lina Congo,,Dwando - Brazzaville,de Havilland Canada DHC-6 Twin Otter 300,TN-ACX,452,8,3,0,Crashed during a severe thunderstorm.
03/12/1992,00:13,"Knotsville, Tennessee",CC Air,,Training,BAe 3101 Jetstream 31,N165PC,683,2,2,0,The crew forgot to lower the landing gear on the approach for a touch-and-go landing. The propellers struck the runway. An emergency was declared and a turn was made. Control was lost and the aircraft crashed. The pilot's failure to use the airplane checklist which resulted in a gear up landing and the pilot's failure to maintain flying speed which resulted in an uncontrolled collision with the ground.
03/22/1992,21:35,"La Guardia Airport, New York, New York",USAir,405,New York City - Cleveland,Fokker F-28 Fellowship 4000,N485US,11235,51,27,0
03/22/1992,,"Near Yakutia, Russia",Aeroflot,,Chekurdakh - Tiksi,Antonov AN-30,RA-30002,1403,10,10,0,"Autopilot engagement and disengagement resulted in oscillations of the aircraft which led to a loss of control and break-up in mid air. Pilot-induced lateral oscillations led to a stall
03/24/1992,07:02,"Athens, Greece",Golden Star Air Cargo,,Amsterdam - Athens,Boeing 707-321C,ST-ALX,18715/364,7,7,0,"The crew deviated from the ILS localizer during an approach to  Runway 33R and struck 2
04/04/1992,,"Near Baykovo, Russia",Kamchatavia,,Etropavlovsk - Kamchatskiy,Let 410UVP,CCCP-67130,800326,12,1,0,The aircraft crashed into high ground 5 km short of the runway in poor weather during a VFR approach.
